{
  "canonical_manifest_path": "C:\\Users\\carlo\\ELIS-SLR-Agent\\.tmp\\pe-gha-02\\test_representative_run_writes0\\review-xyz\\canonical\\ELIS_Appendix_A_Search_rows_manifest.json",
  "canonical_output_path": "C:\\Users\\carlo\\ELIS-SLR-Agent\\.tmp\\pe-gha-02\\test_representative_run_writes0\\review-xyz\\canonical\\ELIS_Appendix_A_Search_rows.json",
  "merge_report_path": "C:\\Users\\carlo\\ELIS-SLR-Agent\\.tmp\\pe-gha-02\\test_representative_run_writes0\\review-xyz\\canonical\\merge_report.json",
  "review_id": "review-xyz",
  "schema_version": "1.0",
  "search_config": "config/searches/electoral_integrity_search.yml",
  "sources": [
    {
      "manifest_path": "C:\\Users\\carlo\\ELIS-SLR-Agent\\.tmp\\pe-gha-02\\test_representative_run_writes0\\review-xyz\\raw\\openalex_manifest.json",
      "output_path": "C:\\Users\\carlo\\ELIS-SLR-Agent\\.tmp\\pe-gha-02\\test_representative_run_writes0\\review-xyz\\raw\\openalex.json",
      "source": "openalex"
    }
  ],
  "tier": "testing",
  "workflow_path": ".github/workflows/elis-agent-search.yml"
}
